{
  "repository": "repo",
  "target_branch": "DETACHED",
  "base_commit": "2efee2371de799f214b8364c68d16ea07434ce46",
  "target_commit": "beecff13c2ba519c768918e4a1e8c3e424b9e254",
  "diff_selection_reason": "frozen_goal_feasibility_v2",
  "changed_files": [
    "transfer.go"
  ],
  "affected_entries": []
}
