{
  "repository": "repo",
  "target_branch": "DETACHED",
  "base_commit": "82785a3633c2cf527a6fe8487ea8dd7637c5f2af",
  "target_commit": "ca760895d10e0c88aa23d781f72ff4db79d70d0b",
  "diff_selection_reason": "frozen_goal_feasibility_v2",
  "changed_files": [
    "route-contract.json",
    "update.go"
  ],
  "affected_entries": []
}
