{
  "repository": "repo",
  "target_branch": "DETACHED",
  "base_commit": "9830ef0f6722b3eb73d22281d31659742fb57e9d",
  "target_commit": "63817ac35790a32b158ff26f38144c1899fdb063",
  "diff_selection_reason": "frozen_goal_feasibility_v1",
  "changed_files": [
    "place.go",
    "place_test.go"
  ],
  "affected_entries": []
}
